category,title,creator,publication_year,description
album,KrebStar Treat,Jim Schamberger,1942,Repellendus sed illo itaque.
book,Huggy Cup,Mac Mante,1996,Quod vero impedit provident.
album,Winter Town,Jovita Wiza Sr.,1989,Et dolorem voluptates nulla.
book,Evening Breaker,Mariella Schamberger,1999,Molestias minima provident placeat.
book,Bluebery Delight,Amb. Valentine Langosh,1992,Veritatis at sunt commodi.
album,Captain's Level,Georgiann Hammes,2002,Illum voluptatem distinctio sit.
album,Melty Cake,Antone Bode,1923,Et sed voluptate et.
album,Summer ,Sharleen Sawayn Esq.,1999,Rerum dolores recusandae maiores.
book,Bluebery Town,Kimiko Tillman,1926,Voluptatem cumque nesciunt ex.
album,Wake-up Enlightenment,Shenika Toy,1979,Qui enim non saepe.
book,Chocolate Volcano,Shan Conn JD,2016,Numquam nulla eaque natus.
album,Good-morning Volcano,Daniela Schultz,1931,Libero et voluptatem qui.
book,Chocolate Town,Leslie Hahn,1997,Sint consequatur vero numquam.
album,The Treat,Sen. Ronnie Kohler,1954,Vitae qui eius laudantium.
book,Blue Symphony,Olympia Altenwerth LLD,1922,Eligendi veniam reiciendis error.
album,Strong Forrester,Trent Oberbrunner Sr.,2018,Dicta libero itaque architecto.
book,Split Been,Jeffery Douglas,1932,Beatae ad nisi eum.
album,Spilt Mug,Harlan Brown,1967,Molestias iure et qui.
book,Red Cowboy,Vanna Haley,2001,Et nihil quam aliquid.
book,Huggy Solstice,Ida Skiles Jr.,1968,Et corporis dignissimos cum.
album,Spilt Look,Sen. Nilsa Jones,1960,Aliquid provident quidem quis.
album,Winter Equinox,Burma Lehner,1973,Ipsum molestiae consectetur odio.
album,Seattle Treat,Phillip Lesch,2015,Libero et vero quidem.
album,Morning ,Junita O'Keefe,1927,Minus qui magni aut.
book,Thanksgiving Pie,Wendi Harvey Jr.,2000,Aut nobis qui doloribus.
